{
  "format": "SCOPE-LONG-RECORDING-EVIDENCE/1",
  "createdAt": "2026-09-14T06:32:00.845Z",
  "result": "PASS",
  "workload": {
    "declaration": "quiet",
    "quietWindow": true,
    "statement": "No UI or development work was intentionally active during final measurements."
  },
  "environment": {
    "platform": "darwin",
    "release": "25.6.0",
    "architecture": "arm64",
    "cpu": "Apple M5 Pro",
    "logicalCpuCount": 15,
    "totalMemoryBytes": 25769803776,
    "node": "v24.21.0"
  },
  "t15Reference": {
    "evidence": "../t15/run-summary.json",
    "verificationEvidence": "../t15/verification.json",
    "recordedEnvironment": {
      "capturedAt": "2026-09-14T04:31:48.274Z",
      "platform": "darwin",
      "release": "25.6.0",
      "architecture": "arm64",
      "cpu": "Apple M5 Pro",
      "logicalCpuCount": 15,
      "totalMemoryBytes": 25769803776,
      "storage": {
        "path": "recordings",
        "fileSystemTypeCode": 26,
        "blockSizeBytes": 4096,
        "totalBytes": 994610155520,
        "freeBytesBefore": 855487381504
      },
      "node": "v24.21.0",
      "npm": "11.19.0",
      "workload": "quiet",
      "uiOrHeavyWorkActive": false,
      "workloadDeclaration": "No UI or development work was intentionally active during the benchmark.",
      "clockMethod": "generator process.hrtime.bigint(); recorder performance.now()"
    },
    "identityMatched": true,
    "platformContext": {
      "matched": true,
      "fields": {
        "platform": {
          "recorded": "darwin",
          "current": "darwin",
          "matched": true
        },
        "release": {
          "recorded": "25.6.0",
          "current": "25.6.0",
          "matched": true
        },
        "architecture": {
          "recorded": "arm64",
          "current": "arm64",
          "matched": true
        },
        "cpu": {
          "recorded": "Apple M5 Pro",
          "current": "Apple M5 Pro",
          "matched": true
        },
        "logicalCpuCount": { "recorded": 15, "current": 15, "matched": true },
        "totalMemoryBytes": {
          "recorded": 25769803776,
          "current": 25769803776,
          "matched": true
        },
        "node": {
          "recorded": "v24.21.0",
          "current": "v24.21.0",
          "matched": true
        }
      }
    }
  },
  "recording": {
    "id": "t15-sustained-2026-09-14",
    "localDirectory": "recordings/t15-sustained-2026-09-14",
    "absolutePathRequired": true,
    "channels": 32,
    "sampleRateFramesPerSecond": 4000,
    "seed": 42,
    "expectedFrames": 14400000,
    "durationSeconds": 3600,
    "recordBytes": 136,
    "frameFileBytes": 1958400000,
    "status": "completed",
    "checkedFiles": {
      "metadata": {
        "dev": "16777230",
        "ino": "4408263",
        "size": 1337,
        "mtimeNs": "1789363908480777751"
      },
      "frames": {
        "dev": "16777230",
        "ino": "4404645",
        "size": 1958400000,
        "mtimeNs": "1789363908467215627"
      }
    }
  },
  "workloadConfiguration": {
    "profile": "full",
    "selectedChannels": [31, 2, 17, 0],
    "retrievalRepetitions": { "warmup": 1, "measured": 5 },
    "exportConsumerDelayMilliseconds": 5,
    "exportDelayEveryDataRows": 2048,
    "playbackSourceTimelineSeconds": 12,
    "playbackEngineeringToleranceFraction": 0.1,
    "slowSinkDelayMillisecondsPerAcceptedBatch": 25,
    "transitionPausedMilliseconds": 2000
  },
  "units": {
    "bytes": "bytes",
    "elapsed": "milliseconds",
    "rate": "frames or samples per second as named",
    "lag": "frames or milliseconds as named",
    "positions": "zero-based frame indices; range ends are exclusive"
  },
  "bounds": {
    "rangeReadBytes": 65536,
    "playback": {
      "maximumBatchFrames": 256,
      "maximumBatchBytes": 65536,
      "maximumCatchUpRecordsPerTick": 4096,
      "previewCapacity": 256
    },
    "exportRetention": "SHA-256 and counters only; CSV bytes are not retained",
    "measurementHistory": "streamed to measurements.jsonl"
  },
  "expectedAmplification": {
    "value": 8.5,
    "formula": "recordBytes / (selectedChannelCount * float32Bytes)",
    "excludes": "extent and lower-bound index probe bytes"
  },
  "retrieval": [
    {
      "kind": "window",
      "label": "window-beginning",
      "requestedWindow": { "start": 0, "end": 4000 },
      "channels": [31, 2, 17, 0],
      "warmup": {
        "elapsedMs": 10.435749999999999,
        "rssBeforeBytes": 94142464,
        "rssAfterBytes": 103301120,
        "processPeakRssBytes": 103301120,
        "metrics": {
          "extentProbeReads": 1,
          "extentProbeBytes": 8,
          "lowerBoundProbeReads": 48,
          "lowerBoundProbeBytes": 384,
          "dataReadCalls": 9,
          "dataBytesRead": 544000,
          "maximumReadBytes": 65416,
          "recordsDecoded": 4000,
          "selectedSamplesReturned": 16000
        },
        "identity": { "firstIndex": 0, "nextIndex": 4000, "frames": 4000 },
        "digestSha256": "07cd403420b51fe7bede2991ac6be3572fc479a0ccbc4b6085df995703b22ee5"
      },
      "measured": [
        {
          "elapsedMs": 4.388708000000001,
          "rssBeforeBytes": 103333888,
          "rssAfterBytes": 103432192,
          "processPeakRssBytes": 103432192,
          "metrics": {
            "extentProbeReads": 1,
            "extentProbeBytes": 8,
            "lowerBoundProbeReads": 48,
            "lowerBoundProbeBytes": 384,
            "dataReadCalls": 9,
            "dataBytesRead": 544000,
            "maximumReadBytes": 65416,
            "recordsDecoded": 4000,
            "selectedSamplesReturned": 16000
          },
          "identity": { "firstIndex": 0, "nextIndex": 4000, "frames": 4000 },
          "digestSha256": "07cd403420b51fe7bede2991ac6be3572fc479a0ccbc4b6085df995703b22ee5"
        },
        {
          "elapsedMs": 4.088333999999996,
          "rssBeforeBytes": 103432192,
          "rssAfterBytes": 103546880,
          "processPeakRssBytes": 103546880,
          "metrics": {
            "extentProbeReads": 1,
            "extentProbeBytes": 8,
            "lowerBoundProbeReads": 48,
            "lowerBoundProbeBytes": 384,
            "dataReadCalls": 9,
            "dataBytesRead": 544000,
            "maximumReadBytes": 65416,
            "recordsDecoded": 4000,
            "selectedSamplesReturned": 16000
          },
          "identity": { "firstIndex": 0, "nextIndex": 4000, "frames": 4000 },
          "digestSha256": "07cd403420b51fe7bede2991ac6be3572fc479a0ccbc4b6085df995703b22ee5"
        },
        {
          "elapsedMs": 5.78425,
          "rssBeforeBytes": 103546880,
          "rssAfterBytes": 104120320,
          "processPeakRssBytes": 104136704,
          "metrics": {
            "extentProbeReads": 1,
            "extentProbeBytes": 8,
            "lowerBoundProbeReads": 48,
            "lowerBoundProbeBytes": 384,
            "dataReadCalls": 9,
            "dataBytesRead": 544000,
            "maximumReadBytes": 65416,
            "recordsDecoded": 4000,
            "selectedSamplesReturned": 16000
          },
          "identity": { "firstIndex": 0, "nextIndex": 4000, "frames": 4000 },
          "digestSha256": "07cd403420b51fe7bede2991ac6be3572fc479a0ccbc4b6085df995703b22ee5"
        },
        {
          "elapsedMs": 3.3631659999999926,
          "rssBeforeBytes": 104136704,
          "rssAfterBytes": 104153088,
          "processPeakRssBytes": 104153088,
          "metrics": {
            "extentProbeReads": 1,
            "extentProbeBytes": 8,
            "lowerBoundProbeReads": 48,
            "lowerBoundProbeBytes": 384,
            "dataReadCalls": 9,
            "dataBytesRead": 544000,
            "maximumReadBytes": 65416,
            "recordsDecoded": 4000,
            "selectedSamplesReturned": 16000
          },
          "identity": { "firstIndex": 0, "nextIndex": 4000, "frames": 4000 },
          "digestSha256": "07cd403420b51fe7bede2991ac6be3572fc479a0ccbc4b6085df995703b22ee5"
        },
        {
          "elapsedMs": 3.2820410000000066,
          "rssBeforeBytes": 104153088,
          "rssAfterBytes": 104153088,
          "processPeakRssBytes": 104153088,
          "metrics": {
            "extentProbeReads": 1,
            "extentProbeBytes": 8,
            "lowerBoundProbeReads": 48,
            "lowerBoundProbeBytes": 384,
            "dataReadCalls": 9,
            "dataBytesRead": 544000,
            "maximumReadBytes": 65416,
            "recordsDecoded": 4000,
            "selectedSamplesReturned": 16000
          },
          "identity": { "firstIndex": 0, "nextIndex": 4000, "frames": 4000 },
          "digestSha256": "07cd403420b51fe7bede2991ac6be3572fc479a0ccbc4b6085df995703b22ee5"
        }
      ],
      "measuredStatistics": {
        "elapsedMs": {
          "first": 4.388708000000001,
          "median": 4.088333999999996,
          "p95": 5.78425,
          "minimum": 3.2820410000000066,
          "maximum": 5.78425
        },
        "rssBeforeBytes": {
          "first": 103333888,
          "median": 103546880,
          "p95": 104153088,
          "minimum": 103333888,
          "maximum": 104153088
        },
        "rssAfterBytes": {
          "first": 103432192,
          "median": 104120320,
          "p95": 104153088,
          "minimum": 103432192,
          "maximum": 104153088
        },
        "processPeakRssBytes": {
          "first": 103432192,
          "median": 104136704,
          "p95": 104153088,
          "minimum": 103432192,
          "maximum": 104153088
        },
        "metrics": {
          "extentProbeReads": {
            "first": 1,
            "median": 1,
            "p95": 1,
            "minimum": 1,
            "maximum": 1
          },
          "extentProbeBytes": {
            "first": 8,
            "median": 8,
            "p95": 8,
            "minimum": 8,
            "maximum": 8
          },
          "lowerBoundProbeReads": {